Name,Riskiness R
Alternatives ETF List (35),0.0005091783764266924
Broad Asia ETF List (44),686163892853.5775
Commodity ETF List (125),0.021258287243842676
Consumer Discretionary Equity ETF List (31),0.00017262003747134274
Consumer Staples Equity ETF List (26),0.00020630100919542127
Crude Oil ETF List (22),0.000169828966403582
Currency ETF List (36),3554486156745.122
Developed Asia Pacific ETF List (108),0.00017619060804556155
Developed Markets ETF List 1 (100),0.0001664921217305795
Developed Markets ETF List 2 (100),0.00018452687856374155
Developed Markets ETF List 3 (93),705812622592.0256
Emerging Asia Pacific ETF List (114),3.7373205781228833
Emerging Markets ETF List (79),0.37320902159362307
Energy Equity ETF List (80),1.0685010750155073
Financials Equity ETF List (51),0.0001811892238374511
Global ETF List (72),0.00019303067399221652
Gold ETF List (17),0.0003947346274342979
Healthcare Equity ETF List (49),0.000181409028212509
Industrials Equity ETF List (37),0.00017845939062982347
Investment Grade Corporate ETF List (50),1483904361851.5603
Junk ETF List (43),0.00023250180499937505
Materials Equity ETF List (62),0.49921410561856033
Municipal Bond ETF List (29),2032093738193.9395
Preferred Stock ETF List (12),0.00036866882114415446
Real Estate ETF List (48),0.00020538875371031186
Target Maturity Date Corporate Bond ETF List (24),722845253184.6632
Technology Equity ETF List (75),0.11316216570538576
Telecom Equity ETF List (10),0.00019028231061738905
Total Bond Market ETF List (82),5.33569612078602e-05
Treasuries ETF List (51),2.710056644450248e-05
Utilities Equity ETF List (24),0.0003611902411214972
Volatility ETF List (18),14506986162271.096
