Name,Riskiness R
Alternatives ETF List (35),0.0004454357880821296
Broad Asia ETF List (44),0.0001808272486881869
Commodity ETF List (125),0.00027365629742248486
Consumer Discretionary Equity ETF List (31),0.00021094549236228664
Consumer Staples Equity ETF List (26),0.00022851856572647685
Crude Oil ETF List (22),4.692510160781047
Currency ETF List (36),2944713429989.5195
Developed Asia Pacific ETF List (108),0.00018308701401713426
Developed Markets ETF List 1 (100),0.00018536061938525313
Developed Markets ETF List 2 (100),0.0001965936135089395
Developed Markets ETF List 3 (93),0.00019584736010513215
Emerging Asia Pacific ETF List (114),0.0003359334433680444
Emerging Markets ETF List (79),0.0003141735648277615
Energy Equity ETF List (80),0.00018700381618641648
Financials Equity ETF List (51),0.00018627842916233786
Global ETF List (72),0.00019592521106318953
Gold ETF List (17),0.00018062568687391892
Healthcare Equity ETF List (49),0.00017404656110782608
Industrials Equity ETF List (37),0.00018299805209586636
Investment Grade Corporate ETF List (50),1065538024614.7585
Junk ETF List (43),1240310916335.859
Materials Equity ETF List (62),0.00019624905514198458
Municipal Bond ETF List (29),1449684219781.8762
Preferred Stock ETF List (12),0.2923660881142579
Real Estate ETF List (48),0.00019493403698859384
Target Maturity Date Corporate Bond ETF List (24),1721236316323.2087
Technology Equity ETF List (75),0.00018602020747130808
Telecom Equity ETF List (10),0.0001958435444831036
Total Bond Market ETF List (82),3.749447769538473e-05
Treasuries ETF List (51),2.677249654598799e-05
Utilities Equity ETF List (24),0.00024863758132391605
Volatility ETF List (18),9153053967199.041
