Name,Riskiness R
Alternatives ETF List (35),14372.307009871816
Broad Asia ETF List (44),0.00016833601359844173
Commodity ETF List (125),2598.308247596783
Consumer Discretionary Equity ETF List (31),0.000173983132577717
Consumer Staples Equity ETF List (26),0.00020190404228615728
Crude Oil ETF List (22),0.00020808800900697612
Currency ETF List (36),0.00044379727773498644
Developed Asia Pacific ETF List (108),0.00017872587570385434
Developed Markets ETF List 1 (100),0.0001664921217305795
Developed Markets ETF List 2 (100),0.00017237413265336644
Developed Markets ETF List 3 (93),0.00018622387852022568
Emerging Asia Pacific ETF List (114),0.0002611011905408921
Emerging Markets ETF List (79),0.0003591998981307405
Energy Equity ETF List (80),14470651926062.041
Financials Equity ETF List (51),0.00018447206707427265
Global ETF List (72),0.8319058011600218
Gold ETF List (17),0.0004042711712524533
Healthcare Equity ETF List (49),0.00018135309795132255
Industrials Equity ETF List (37),0.00018608510327473496
Investment Grade Corporate ETF List (50),2565805071418.8906
Junk ETF List (43),0.0015415942234339372
Materials Equity ETF List (62),0.00020855503715957698
Municipal Bond ETF List (29),1489469005696.228
Preferred Stock ETF List (12),0.00036866882114415446
Real Estate ETF List (48),0.00021484455475178756
Target Maturity Date Corporate Bond ETF List (24),246747498097.27405
Technology Equity ETF List (75),0.43582715649500775
Telecom Equity ETF List (10),0.00017916702908832367
Total Bond Market ETF List (82),9.782815738571394e-05
Treasuries ETF List (51),1921641012455.2788
Utilities Equity ETF List (24),0.00023366896795901944
Volatility ETF List (18),9310643675378.38
