Name,Riskiness R
Alternatives ETF List (35),0.0006733341000322366
Broad Asia ETF List (44),1469404336964.7407
Commodity ETF List (125),0.021224746285419326
Consumer Discretionary Equity ETF List (31),0.00017262003747134274
Consumer Staples Equity ETF List (26),0.00019972354724809906
Crude Oil ETF List (22),0.0001834762338392857
Currency ETF List (36),2167491038459.1216
Developed Asia Pacific ETF List (108),0.00017619060804556155
Developed Markets ETF List 1 (100),0.0001664921217305795
Developed Markets ETF List 2 (100),0.00018452687856374155
Developed Markets ETF List 3 (93),764785267350.3486
Emerging Asia Pacific ETF List (114),1.5831300685740104
Emerging Markets ETF List (79),0.4431858365331005
Energy Equity ETF List (80),1.0329348849967728
Financials Equity ETF List (51),0.0001811892238374511
Global ETF List (72),0.00019303067399221652
Gold ETF List (17),0.0003947346274342979
Healthcare Equity ETF List (49),0.0001814093458448924
Industrials Equity ETF List (37),0.00017845939062982347
Investment Grade Corporate ETF List (50),1199611800269.043
Junk ETF List (43),0.00023250180499937505
Materials Equity ETF List (62),0.4827757926158934
Municipal Bond ETF List (29),2143989529410.751
Preferred Stock ETF List (12),0.00036866882114415446
Real Estate ETF List (48),0.00020538875371031186
Target Maturity Date Corporate Bond ETF List (24),818042981963.8032
Technology Equity ETF List (75),0.13150220085535452
Telecom Equity ETF List (10),0.00019028231061738905
Total Bond Market ETF List (82),5.335696092332831e-05
Treasuries ETF List (51),2.710056644450248e-05
Utilities Equity ETF List (24),0.00036119024511055816
Volatility ETF List (18),14434684106757.773
