Name,Riskiness R
Alternatives ETF List (35),0.0005091783764266924
Broad Asia ETF List (44),1039217023537.9127
Commodity ETF List (125),0.02148026234114618
Consumer Discretionary Equity ETF List (31),0.00017262003747134274
Consumer Staples Equity ETF List (26),0.00020630100919542127
Crude Oil ETF List (22),0.00022849204615693562
Currency ETF List (36),1342644990998.4243
Developed Asia Pacific ETF List (108),0.00017619060804556155
Developed Markets ETF List 1 (100),0.0001664921217305795
Developed Markets ETF List 2 (100),0.00018452687856374155
Developed Markets ETF List 3 (93),2013013606065.9932
Emerging Asia Pacific ETF List (114),22.006958938939523
Emerging Markets ETF List (79),0.485479063074672
Energy Equity ETF List (80),1.1183493458620508
Financials Equity ETF List (51),0.0001811892238374511
Global ETF List (72),0.00019303067399221652
Gold ETF List (17),0.0003947346274342979
Healthcare Equity ETF List (49),0.000181409028212509
Industrials Equity ETF List (37),0.00017845939062982347
Investment Grade Corporate ETF List (50),2744580896871.2075
Junk ETF List (43),0.00023250180499937505
Materials Equity ETF List (62),0.5463856800792865
Municipal Bond ETF List (29),2022451098610.4688
Preferred Stock ETF List (12),0.00036866882114415446
Real Estate ETF List (48),0.00020538875371031186
Target Maturity Date Corporate Bond ETF List (24),744146551579.2501
Technology Equity ETF List (75),0.128713104265836
Telecom Equity ETF List (10),0.00019028231061738905
Total Bond Market ETF List (82),5.335696122138927e-05
Treasuries ETF List (51),2.7100566444502535e-05
Utilities Equity ETF List (24),0.00036119024112457165
Volatility ETF List (18),14452230375850.334
