Name,Riskiness R
Alternatives ETF List (35),7.531906794513835
Broad Asia ETF List (44),0.0001753044570992267
Commodity ETF List (125),0.02099511858578814
Consumer Discretionary Equity ETF List (31),0.00017262003747134274
Consumer Staples Equity ETF List (26),0.0001997235472556618
Crude Oil ETF List (22),0.000169828966403582
Currency ETF List (36),916477652734.4305
Developed Asia Pacific ETF List (108),0.00017619060804556155
Developed Markets ETF List 1 (100),0.0001664921217305795
Developed Markets ETF List 2 (100),0.0001831160683122958
Developed Markets ETF List 3 (93),5366560783061.684
Emerging Asia Pacific ETF List (114),2.4810107141530167
Emerging Markets ETF List (79),0.3580189760081867
Energy Equity ETF List (80),2842846272752.3364
Financials Equity ETF List (51),0.0001811892238374511
Global ETF List (72),0.00019303067299305266
Gold ETF List (17),0.0003947346274342979
Healthcare Equity ETF List (49),0.00018135309795132255
Industrials Equity ETF List (37),0.00017867669521681436
Investment Grade Corporate ETF List (50),1529113751783.5652
Junk ETF List (43),0.00023250180499937505
Materials Equity ETF List (62),0.00020855503715957698
Municipal Bond ETF List (29),2750416973737.297
Preferred Stock ETF List (12),0.00036866882114415446
Real Estate ETF List (48),0.0002053887537018528
Target Maturity Date Corporate Bond ETF List (24),2833654319576.801
Technology Equity ETF List (75),0.11233170555613124
Telecom Equity ETF List (10),0.0002623418462760453
Total Bond Market ETF List (82),5.334862494384271e-05
Treasuries ETF List (51),2.7100566444502535e-05
Utilities Equity ETF List (24),0.0003607975070389726
Volatility ETF List (18),7165437881012.486
