Name,Riskiness R
Alternatives ETF List (35),0.00021453149307407027
Healthcare Equity ETF List (49),0.002797679777884414
Developed Markets ETF List 1 (100),0.00018413812365039497
Target Maturity Date Corporate Bond ETF List (24),0.0007083898492760555
Global ETF List (72),26851.28832786945
Municipal Bond ETF List (29),0.0004493927391996394
Junk ETF List (43),0.00023389510295337274
Commodity ETF List (125),0.0002160969691102625
Volatility ETF List (18),0.9017629624692244
Currency ETF List (36),6032.233593818045
Developed Markets ETF List 2 (100),0.0004574970816652602
Industrials Equity ETF List (37),0.0658324840651003
Financials Equity ETF List (51),0.00019322777597157166
Broad Asia ETF List (44),0.12456044874539544
Preferred Stock ETF List (12),0.000322335129162757
Emerging Asia Pacific ETF List (114),1.3160499670669674
Energy Equity ETF List (80),16898313245709.365
Emerging Markets ETF List (79),0.00018964674829458528
Telecom Equity ETF List (10),0.00018243352900852274
Technology Equity ETF List (75),0.07083585761581943
Consumer Staples Equity ETF List (26),0.0001868460477986065
Developed Asia Pacific ETF List (108),0.00017819103768099232
Materials Equity ETF List (62),0.003874598447596803
Real Estate ETF List (48),0.00016676912558365227
Utilities Equity ETF List (24),0.00023595885115381755
Consumer Discretionary Equity ETF List (31),0.08471423745333054
Total Bond Market ETF List (82),5.9787722097846756e-05
Developed Markets ETF List 3 (93),6507699180752.773
Treasuries ETF List (51),5929618140695.059
Gold ETF List (17),411664364368.34814
Crude Oil ETF List (22),5409224447736.256
Investment Grade Corporate ETF List (50),6.628996469403077
